{"type":"mail.received.v1","event_id":"f8c1e9a0-1a98-4fb8-8ca1-4c0a3e710001","received_at":"2026-09-23T16:00:00Z","message":{"id":"f8c1e9a0-1a98-4fb8-8ca1-4c0a3e710002","from":[{"address":"sender@example.org","name":"Sender"},{"address":"second@example.org","name":""}],"to":[{"address":"owner@example.org","name":"Owner"}],"subject":"Quarterly report ready","sent_at":"2026-09-23T08:30:15-07:00","rfc_message_id":null,"text":"Synthetic mail body","attachments":[]}}