{"type":"mail.received.v1","event_id":"f8c1e9a0-1a98-4fb8-8ca1-4c0a3e710014","received_at":"2026-09-28T08:00:00.000Z","message":{"id":"f8c1e9a0-1a98-4fb8-8ca1-4c0a3e720014","from":[{"address":"sender@example.org","name":"Sender Example"}],"to":[{"address":"other@example.com","name":"Other Person"}],"subject":"Quarterly report","sent_at":"+010000-01-01T00:00:00.000Z","rfc_message_id":"synthetic-1@example.org","text":"A spam-like Date header in year 10000.","text_truncated":false,"original_text_bytes":38,"html_omitted":false,"needs_review":false,"warnings":[],"content_policy_version":"storage-v1","attachments_omitted_count":0,"attachments":[]}}