{"type":"mail.received.v1","event_id":"f8c1e9a0-1a98-4fb8-8ca1-4c0a3e710006","received_at":"2026-09-28T08:00:00.000Z","message":{"id":"f8c1e9a0-1a98-4fb8-8ca1-4c0a3e720006","from":[{"address":"sender@example.org","name":"Sender Example"}],"to":[{"address":"other@example.com","name":"Other Person"}],"subject":"Quarterly report","sent_at":"2026-09-28T07:59:30.000Z","rfc_message_id":"synthetic-1@example.org","text":"See attachments.","text_truncated":false,"original_text_bytes":16,"html_omitted":false,"needs_review":false,"warnings":["attachment_copies_omitted"],"content_policy_version":"storage-v1","attachments_omitted_count":0,"attachments":[{"filename":"report.pdf","content_type":"application/pdf","size":1234,"storage_status":"stored"},{"filename":"huge.bin","content_type":"application/octet-stream","size":2097153,"storage_status":"omitted","omitted_reason":"size_limit"},{"filename":"logo.png","content_type":"image/png","size":512,"storage_status":"omitted","omitted_reason":"inline_image"},{"filename":"part1.zip","content_type":"application/zip","size":1945600,"storage_status":"stored"},{"filename":"part2.zip","content_type":"application/zip","size":1945600,"storage_status":"stored"},{"filename":"part3.zip","content_type":"application/zip","size":1945600,"storage_status":"omitted","omitted_reason":"message_size_limit"}]}}