{"type":"mail.received.v1","event_id":"f8c1e9a0-1a98-4fb8-8ca1-4c0a3e710011","received_at":"2026-09-24T01:02:03Z","message":{"id":"f8c1e9a0-1a98-4fb8-8ca1-4c0a3e710012","from":[{"address":"fa-jian-ren@example.org","name":"发件人"}],"to":[],"subject":"季度报告已准备好 🙂","sent_at":null,"rfc_message_id":"synthetic@example.org","text":"合成邮件正文","attachments":[{"filename":"报告.pdf","content_type":"application/pdf","size":1234}]}}