{"type":"mail.received.v1","event_id":"f8c1e9a0-1a98-4fb8-8ca1-4c0a3e710016","received_at":"2026-09-28T08:00:00.000Z","message":{"id":"f8c1e9a0-1a98-4fb8-8ca1-4c0a3e720016","from":[{"address":"sender@example.org","name":"Sender Example"}],"to":[{"address":"other@example.com","name":"Other Person"}],"subject":"Quarterly report","sent_at":"2026-09-28T07:59:30.000Z","rfc_message_id":"synthetic-1@example.org","text":"Frozen before the content policy.","attachments":[]}}