{"type":"mail.received.v1","event_id":"f8c1e9a0-1a98-4fb8-8ca1-4c0a3e710015","received_at":"2026-09-28T08:00:00.000Z","message":{"id":"f8c1e9a0-1a98-4fb8-8ca1-4c0a3e720015","from":[{"address":"synthetic@example.org","name":"Mail Hero"}],"to":[],"subject":"Mail Hero webhook test","sent_at":null,"rfc_message_id":null,"text":"This is a synthetic Mail Hero connection test.","text_truncated":false,"original_text_bytes":46,"html_omitted":false,"needs_review":false,"warnings":[],"content_policy_version":"storage-v1","attachments_omitted_count":0,"attachments":[]}}