{"type":"mail.received.v1","event_id":"f8c1e9a0-1a98-4fb8-8ca1-4c0a3e710002","received_at":"2026-09-28T08:00:00.000Z","message":{"id":"f8c1e9a0-1a98-4fb8-8ca1-4c0a3e720002","from":[{"address":"zhangsan@example.org","name":"张三"}],"to":[{"address":"lisi@example.com","name":"李四"}],"subject":"季度预缴税提醒：10 月 15 日截止","sent_at":"2026-09-28T07:59:30.000Z","rfc_message_id":"synthetic-1@example.org","text":"您好，\n\n请在 10 月 15 日前完成季度预缴税。#重要 附件见邮件。\n\n—— 合成测试邮件","text_truncated":false,"original_text_bytes":111,"html_omitted":false,"needs_review":false,"warnings":[],"content_policy_version":"storage-v1","attachments_omitted_count":0,"attachments":[]}}