{"type":"mail.received.v1","event_id":"f8c1e9a0-1a98-4fb8-8ca1-4c0a3e710007","received_at":"2026-09-28T08:00:00.000Z","message":{"id":"f8c1e9a0-1a98-4fb8-8ca1-4c0a3e720007","from":[{"address":"sender@example.org","name":"Sender Example"}],"to":[{"address":"other@example.com","name":"Other Person"}],"subject":"Quarterly report","sent_at":"2026-09-28T07:59:30.000Z","rfc_message_id":"synthetic-1@example.org","text":"Capacity protection skipped the copy.","text_truncated":false,"original_text_bytes":37,"html_omitted":false,"needs_review":false,"warnings":["attachment_copies_omitted"],"content_policy_version":"storage-v1","attachments_omitted_count":0,"attachments":[{"filename":"notes.txt","content_type":"text/plain","size":64,"storage_status":"omitted","omitted_reason":"capacity"}]}}