{"type":"mail.received.v1","event_id":"f8c1e9a0-1a98-4fb8-8ca1-4c0a3e710008","received_at":"2026-09-28T08:00:00.000Z","message":{"id":"f8c1e9a0-1a98-4fb8-8ca1-4c0a3e720008","from":[{"address":"sender@example.org","name":"Sender Example"}],"to":[{"address":"other@example.com","name":"Other Person"}],"subject":"Quarterly report","sent_at":"2026-09-28T07:59:30.000Z","rfc_message_id":"synthetic-1@example.org","text":"Many small files.","text_truncated":false,"original_text_bytes":17,"html_omitted":false,"needs_review":false,"warnings":["attachment_metadata_limit"],"content_policy_version":"storage-v1","attachments_omitted_count":5,"attachments":[{"filename":"f1.txt","content_type":"text/plain","size":8,"storage_status":"stored"},{"filename":"f2.txt","content_type":"text/plain","size":8,"storage_status":"stored"},{"filename":"f3.txt","content_type":"text/plain","size":8,"storage_status":"stored"},{"filename":"f4.txt","content_type":"text/plain","size":8,"storage_status":"stored"},{"filename":"f5.txt","content_type":"text/plain","size":8,"storage_status":"stored"},{"filename":"f6.txt","content_type":"text/plain","size":8,"storage_status":"stored"},{"filename":"f7.txt","content_type":"text/plain","size":8,"storage_status":"stored"},{"filename":"f8.txt","content_type":"text/plain","size":8,"storage_status":"stored"},{"filename":"f9.txt","content_type":"text/plain","size":8,"storage_status":"stored"},{"filename":"f10.txt","content_type":"text/plain","size":8,"storage_status":"stored"},{"filename":"f11.txt","content_type":"text/plain","size":8,"storage_status":"stored"},{"filename":"f12.txt","content_type":"text/plain","size":8,"storage_status":"stored"},{"filename":"f13.txt","content_type":"text/plain","size":8,"storage_status":"stored"},{"filename":"f14.txt","content_type":"text/plain","size":8,"storage_status":"stored"},{"filename":"f15.txt","content_type":"text/plain","size":8,"storage_status":"stored"},{"filename":"f16.txt","content_type":"text/plain","size":8,"storage_status":"stored"},{"filename":"f17.txt","content_type":"text/plain","size":8,"storage_status":"stored"},{"filename":"f18.txt","content_type":"text/plain","size":8,"storage_status":"stored"},{"filename":"f19.txt","content_type":"text/plain","size":8,"storage_status":"stored"},{"filename":"f20.txt","content_type":"text/plain","size":8,"storage_status":"stored"},{"filename":"f21.txt","content_type":"text/plain","size":8,"storage_status":"stored"},{"filename":"f22.txt","content_type":"text/plain","size":8,"storage_status":"stored"},{"filename":"f23.txt","content_type":"text/plain","size":8,"storage_status":"stored"},{"filename":"f24.txt","content_type":"text/plain","size":8,"storage_status":"stored"},{"filename":"f25.txt","content_type":"text/plain","size":8,"storage_status":"stored"},{"filename":"f26.txt","content_type":"text/plain","size":8,"storage_status":"stored"},{"filename":"f27.txt","content_type":"text/plain","size":8,"storage_status":"stored"},{"filename":"f28.txt","content_type":"text/plain","size":8,"storage_status":"stored"},{"filename":"f29.txt","content_type":"text/plain","size":8,"storage_status":"stored"},{"filename":"f30.txt","content_type":"text/plain","size":8,"storage_status":"stored"},{"filename":"f31.txt","content_type":"text/plain","size":8,"storage_status":"stored"},{"filename":"f32.txt","content_type":"text/plain","size":8,"storage_status":"stored"},{"filename":"f33.txt","content_type":"text/plain","size":8,"storage_status":"stored"},{"filename":"f34.txt","content_type":"text/plain","size":8,"storage_status":"stored"},{"filename":"f35.txt","content_type":"text/plain","size":8,"storage_status":"stored"},{"filename":"f36.txt","content_type":"text/plain","size":8,"storage_status":"stored"},{"filename":"f37.txt","content_type":"text/plain","size":8,"storage_status":"stored"},{"filename":"f38.txt","content_type":"text/plain","size":8,"storage_status":"stored"},{"filename":"f39.txt","content_type":"text/plain","size":8,"storage_status":"stored"},{"filename":"f40.txt","content_type":"text/plain","size":8,"storage_status":"stored"},{"filename":"f41.txt","content_type":"text/plain","size":8,"storage_status":"stored"},{"filename":"f42.txt","content_type":"text/plain","size":8,"storage_status":"stored"},{"filename":"f43.txt","content_type":"text/plain","size":8,"storage_status":"stored"},{"filename":"f44.txt","content_type":"text/plain","size":8,"storage_status":"stored"},{"filename":"f45.txt","content_type":"text/plain","size":8,"storage_status":"stored"},{"filename":"f46.txt","content_type":"text/plain","size":8,"storage_status":"stored"},{"filename":"f47.txt","content_type":"text/plain","size":8,"storage_status":"stored"},{"filename":"f48.txt","content_type":"text/plain","size":8,"storage_status":"stored"},{"filename":"f49.txt","content_type":"text/plain","size":8,"storage_status":"stored"},{"filename":"f50.txt","content_type":"text/plain","size":8,"storage_status":"stored"},{"filename":"f51.txt","content_type":"text/plain","size":8,"storage_status":"stored"},{"filename":"f52.txt","content_type":"text/plain","size":8,"storage_status":"stored"},{"filename":"f53.txt","content_type":"text/plain","size":8,"storage_status":"stored"},{"filename":"f54.txt","content_type":"text/plain","size":8,"storage_status":"stored"},{"filename":"f55.txt","content_type":"text/plain","size":8,"storage_status":"stored"},{"filename":"f56.txt","content_type":"text/plain","size":8,"storage_status":"stored"},{"filename":"f57.txt","content_type":"text/plain","size":8,"storage_status":"stored"},{"filename":"f58.txt","content_type":"text/plain","size":8,"storage_status":"stored"},{"filename":"f59.txt","content_type":"text/plain","size":8,"storage_status":"stored"},{"filename":"f60.txt","content_type":"text/plain","size":8,"storage_status":"stored"},{"filename":"f61.txt","content_type":"text/plain","size":8,"storage_status":"stored"},{"filename":"f62.txt","content_type":"text/plain","size":8,"storage_status":"stored"},{"filename":"f63.txt","content_type":"text/plain","size":8,"storage_status":"stored"},{"filename":"f64.txt","content_type":"text/plain","size":8,"storage_status":"stored"},{"filename":"f65.txt","content_type":"text/plain","size":8,"storage_status":"stored"},{"filename":"f66.txt","content_type":"text/plain","size":8,"storage_status":"stored"},{"filename":"f67.txt","content_type":"text/plain","size":8,"storage_status":"stored"},{"filename":"f68.txt","content_type":"text/plain","size":8,"storage_status":"stored"},{"filename":"f69.txt","content_type":"text/plain","size":8,"storage_status":"stored"},{"filename":"f70.txt","content_type":"text/plain","size":8,"storage_status":"stored"},{"filename":"f71.txt","content_type":"text/plain","size":8,"storage_status":"stored"},{"filename":"f72.txt","content_type":"text/plain","size":8,"storage_status":"stored"},{"filename":"f73.txt","content_type":"text/plain","size":8,"storage_status":"stored"},{"filename":"f74.txt","content_type":"text/plain","size":8,"storage_status":"stored"},{"filename":"f75.txt","content_type":"text/plain","size":8,"storage_status":"stored"},{"filename":"f76.txt","content_type":"text/plain","size":8,"storage_status":"stored"},{"filename":"f77.txt","content_type":"text/plain","size":8,"storage_status":"stored"},{"filename":"f78.txt","content_type":"text/plain","size":8,"storage_status":"stored"},{"filename":"f79.txt","content_type":"text/plain","size":8,"storage_status":"stored"},{"filename":"f80.txt","content_type":"text/plain","size":8,"storage_status":"stored"},{"filename":"f81.txt","content_type":"text/plain","size":8,"storage_status":"stored"},{"filename":"f82.txt","content_type":"text/plain","size":8,"storage_status":"stored"},{"filename":"f83.txt","content_type":"text/plain","size":8,"storage_status":"stored"},{"filename":"f84.txt","content_type":"text/plain","size":8,"storage_status":"stored"},{"filename":"f85.txt","content_type":"text/plain","size":8,"storage_status":"stored"},{"filename":"f86.txt","content_type":"text/plain","size":8,"storage_status":"stored"},{"filename":"f87.txt","content_type":"text/plain","size":8,"storage_status":"stored"},{"filename":"f88.txt","content_type":"text/plain","size":8,"storage_status":"stored"},{"filename":"f89.txt","content_type":"text/plain","size":8,"storage_status":"stored"},{"filename":"f90.txt","content_type":"text/plain","size":8,"storage_status":"stored"},{"filename":"f91.txt","content_type":"text/plain","size":8,"storage_status":"stored"},{"filename":"f92.txt","content_type":"text/plain","size":8,"storage_status":"stored"},{"filename":"f93.txt","content_type":"text/plain","size":8,"storage_status":"stored"},{"filename":"f94.txt","content_type":"text/plain","size":8,"storage_status":"stored"},{"filename":"f95.txt","content_type":"text/plain","size":8,"storage_status":"stored"},{"filename":"f96.txt","content_type":"text/plain","size":8,"storage_status":"stored"},{"filename":"f97.txt","content_type":"text/plain","size":8,"storage_status":"stored"},{"filename":"f98.txt","content_type":"text/plain","size":8,"storage_status":"stored"},{"filename":"f99.txt","content_type":"text/plain","size":8,"storage_status":"stored"},{"filename":"f100.txt","content_type":"text/plain","size":8,"storage_status":"stored"}]}}