{"type":"mail.received.v1","event_id":"f8c1e9a0-1a98-4fb8-8ca1-4c0a3e710005","received_at":"2026-09-28T08:00:00.000Z","message":{"id":"f8c1e9a0-1a98-4fb8-8ca1-4c0a3e720005","from":[{"address":"bare@example.org","name":""}],"to":[],"subject":"Quarterly report","sent_at":null,"rfc_message_id":null,"text":"No Date or Message-ID header; only the inbox as recipient.","text_truncated":false,"original_text_bytes":58,"html_omitted":false,"needs_review":false,"warnings":[],"content_policy_version":"storage-v1","attachments_omitted_count":0,"attachments":[]}}