{"type":"mail.received.v1","event_id":"f8c1e9a0-1a98-4fb8-8ca1-4c0a3e710021","received_at":"2026-09-25T10:20:30.123456Z","message":{"id":"f8c1e9a0-1a98-4fb8-8ca1-4c0a3e710022","from":[],"to":[{"address":"owner@example.org","name":""}],"subject":"   ","sent_at":null,"rfc_message_id":null,"text":"中文🙂","text_truncated":true,"original_text_bytes":300000,"content_policy_version":"storage-v1","attachments":[]}}